[
  {
    "schema_version": 1,
    "event_id": "event_attempt_demo_01_created",
    "sequence": 3,
    "conversation_id": "chat_demo",
    "task_id": "task_demo_voice_docs",
    "primary_agent_run_id": "agent_run_demo_01",
    "attempt_id": "attempt_demo_01",
    "event_type": "attempt.created",
    "previous_state": null,
    "resulting_state": "created",
    "context_version": 7,
    "actor": {
      "role": "controller",
      "id": "task_controller"
    },
    "idempotency_key": "task_demo_voice_docs:attempt_demo_01:created",
    "occurred_at": "2026-08-02T12:00:55Z",
    "reason": "The controller created the first execution attempt.",
    "attempt": {
      "schema_version": 1,
      "conversation_id": "chat_demo",
      "task_id": "task_demo_voice_docs",
      "primary_agent_run_id": "agent_run_demo_01",
      "attempt_id": "attempt_demo_01",
      "ordinal": 1,
      "resumes_attempt_id": null,
      "provider_session_id": null,
      "state": "created",
      "context_version": 7,
      "slot_lease": {
        "status": "none",
        "lease_id": null,
        "acquired_at": null,
        "released_at": null,
        "release_reason": null,
        "release_receipt_id": null
      },
      "writer_lock_ids": [],
      "capability_lease_ids": [],
      "checkpoint_ref": null,
      "failure": null,
      "created_at": "2026-08-02T12:00:55Z",
      "updated_at": "2026-08-02T12:00:55Z",
      "terminal_at": null
    },
    "transaction_id": "tx_attempt_created"
  },
  {
    "schema_version": 1,
    "event_id": "event_attempt_demo_01_queued",
    "sequence": 4,
    "conversation_id": "chat_demo",
    "task_id": "task_demo_voice_docs",
    "primary_agent_run_id": "agent_run_demo_01",
    "attempt_id": "attempt_demo_01",
    "event_type": "attempt.queued",
    "previous_state": "created",
    "resulting_state": "queued",
    "context_version": 7,
    "actor": {
      "role": "controller",
      "id": "task_controller"
    },
    "idempotency_key": "task_demo_voice_docs:attempt_demo_01:queued",
    "occurred_at": "2026-08-02T12:00:56Z",
    "reason": "The attempt is eligible for the conversation primary slot.",
    "attempt": {
      "schema_version": 1,
      "conversation_id": "chat_demo",
      "task_id": "task_demo_voice_docs",
      "primary_agent_run_id": "agent_run_demo_01",
      "attempt_id": "attempt_demo_01",
      "ordinal": 1,
      "resumes_attempt_id": null,
      "provider_session_id": null,
      "state": "queued",
      "context_version": 7,
      "slot_lease": {
        "status": "none",
        "lease_id": null,
        "acquired_at": null,
        "released_at": null,
        "release_reason": null,
        "release_receipt_id": null
      },
      "writer_lock_ids": [],
      "capability_lease_ids": [],
      "checkpoint_ref": null,
      "failure": null,
      "created_at": "2026-08-02T12:00:55Z",
      "updated_at": "2026-08-02T12:00:56Z",
      "terminal_at": null
    },
    "transaction_id": "tx_attempt_queued"
  },
  {
    "schema_version": 1,
    "event_id": "event_attempt_demo_01_starting",
    "sequence": 5,
    "conversation_id": "chat_demo",
    "task_id": "task_demo_voice_docs",
    "primary_agent_run_id": "agent_run_demo_01",
    "attempt_id": "attempt_demo_01",
    "event_type": "attempt.starting",
    "previous_state": "queued",
    "resulting_state": "starting",
    "context_version": 7,
    "actor": {
      "role": "controller",
      "id": "task_controller"
    },
    "idempotency_key": "task_demo_voice_docs:attempt_demo_01:starting",
    "occurred_at": "2026-08-02T12:00:59Z",
    "reason": "The scheduler acquired the primary slot and started the private worker.",
    "attempt": {
      "schema_version": 1,
      "conversation_id": "chat_demo",
      "task_id": "task_demo_voice_docs",
      "primary_agent_run_id": "agent_run_demo_01",
      "attempt_id": "attempt_demo_01",
      "ordinal": 1,
      "resumes_attempt_id": null,
      "provider_session_id": "provider_task_session_demo_01",
      "state": "starting",
      "context_version": 7,
      "slot_lease": {
        "status": "acquired",
        "lease_id": "primary_slot_chat_demo",
        "acquired_at": "2026-08-02T12:00:59Z",
        "released_at": null,
        "release_reason": null,
        "release_receipt_id": null
      },
      "writer_lock_ids": [],
      "capability_lease_ids": [],
      "checkpoint_ref": null,
      "failure": null,
      "created_at": "2026-08-02T12:00:55Z",
      "updated_at": "2026-08-02T12:00:59Z",
      "terminal_at": null
    },
    "transaction_id": "tx_attempt_starting"
  },
  {
    "schema_version": 1,
    "event_id": "event_attempt_demo_01_running",
    "sequence": 6,
    "conversation_id": "chat_demo",
    "task_id": "task_demo_voice_docs",
    "primary_agent_run_id": "agent_run_demo_01",
    "attempt_id": "attempt_demo_01",
    "event_type": "attempt.running",
    "previous_state": "starting",
    "resulting_state": "running",
    "context_version": 7,
    "actor": {
      "role": "controller",
      "id": "task_controller"
    },
    "idempotency_key": "task_demo_voice_docs:attempt_demo_01:running",
    "occurred_at": "2026-08-02T12:01:00Z",
    "reason": "The private primary worker reported ready.",
    "attempt": {
      "schema_version": 1,
      "conversation_id": "chat_demo",
      "task_id": "task_demo_voice_docs",
      "primary_agent_run_id": "agent_run_demo_01",
      "attempt_id": "attempt_demo_01",
      "ordinal": 1,
      "resumes_attempt_id": null,
      "provider_session_id": "provider_task_session_demo_01",
      "state": "running",
      "context_version": 7,
      "slot_lease": {
        "status": "acquired",
        "lease_id": "primary_slot_chat_demo",
        "acquired_at": "2026-08-02T12:00:59Z",
        "released_at": null,
        "release_reason": null,
        "release_receipt_id": null
      },
      "writer_lock_ids": [
        "writer_lock_docs"
      ],
      "capability_lease_ids": [],
      "checkpoint_ref": null,
      "failure": null,
      "created_at": "2026-08-02T12:00:55Z",
      "updated_at": "2026-08-02T12:01:00Z",
      "terminal_at": null
    },
    "transaction_id": "tx_attempt_start_ready"
  },
  {
    "schema_version": 1,
    "event_id": "event_attempt_demo_01_completed",
    "sequence": 10,
    "conversation_id": "chat_demo",
    "task_id": "task_demo_voice_docs",
    "primary_agent_run_id": "agent_run_demo_01",
    "attempt_id": "attempt_demo_01",
    "event_type": "attempt.completed",
    "previous_state": "running",
    "resulting_state": "completed",
    "context_version": 7,
    "actor": {
      "role": "controller",
      "id": "task_controller"
    },
    "idempotency_key": "task_demo_voice_docs:attempt_demo_01:completed",
    "occurred_at": "2026-08-02T12:25:00Z",
    "reason": "The completion candidate and checkpoint are durable; slot, lock, and leases are released.",
    "attempt": {
      "schema_version": 1,
      "conversation_id": "chat_demo",
      "task_id": "task_demo_voice_docs",
      "primary_agent_run_id": "agent_run_demo_01",
      "attempt_id": "attempt_demo_01",
      "ordinal": 1,
      "resumes_attempt_id": null,
      "provider_session_id": "provider_task_session_demo_01",
      "state": "completed",
      "context_version": 7,
      "slot_lease": {
        "status": "released",
        "lease_id": "primary_slot_chat_demo",
        "acquired_at": "2026-08-02T12:00:59Z",
        "released_at": "2026-08-02T12:25:00Z",
        "release_reason": "The primary submitted a completion candidate and released execution authority.",
        "release_receipt_id": "slot_release_receipt_attempt_demo_01"
      },
      "writer_lock_ids": [],
      "capability_lease_ids": [],
      "checkpoint_ref": {
        "kind": "completion_candidate",
        "id": "completion_candidate_voice_docs"
      },
      "failure": null,
      "created_at": "2026-08-02T12:00:55Z",
      "updated_at": "2026-08-02T12:25:00Z",
      "terminal_at": "2026-08-02T12:25:00Z"
    },
    "transaction_id": "tx_completion_handoff"
  }
]
